{
  "breaches": [
    {
      "blocks_promotion": true,
      "observed": "0 days and 2 signals",
      "threshold": ">= 30 days and >= 500 signals"
    }
  ],
  "comparisons": {
    "cost_divergence": 0.0,
    "fill_divergence": 0.0,
    "latency_p95_ns": 1000000,
    "pnl_divergence": 1.261465409846964e-13,
    "signal_divergence": 0.0
  },
  "created_at": "2026-07-10T00:00:00Z",
  "decision": {
    "next_action": "continue observation without changing StrategySpec",
    "reason": "paper window or divergence gate is incomplete",
    "status": "blocked"
  },
  "id": "diagnostic-divergence-v1",
  "observation_manifest": "observation_manifest.json",
  "paper_plan": "paper_plan.json",
  "sample": {
    "end_time": "2024-01-01T01:35:00Z",
    "observed_days": 0,
    "signals": 2,
    "simulated_orders": 2,
    "start_time": "2024-01-01T00:00:00Z"
  },
  "schema_version": 2
}
